Tier,Name,BibTex (Unverified),Dependencies,Relationship,Category,Encoder / Decoder,Description,Key Technique,Architecture,(Pre)-training Objective
5,M3DocRAG,cho2024m3docrag,ColPali; Qwen2-VL; RAG,visual page retrieval; answer generation backbone; retrieval-augmented framework,Multi-Page VRDU Model,N/A,N/A,"Retrieves relevant document pages using ColPali visual embeddings rather than OCR, preserving visual information --> MLLM (Qwen2-VL)",PDF --> RGB images --> ColPali --> Retrieval --> MaxSim scoring --> MLLM Answer generation,N/A (ColPali + Qwen2VL pretrained)
5,VDocRAG,tanaka2025vdocrag,CLIP; Qwen2-VL; RAG; LoRA,contrastive visual embedding; VLM backbone; retrieve-then-read paradigm; parameter-efficient fine-tuning,Multi-Page VRDU Model,N/A,N/A,"2 component RAG framework (VDocRetriever + VDocGenerator) , retriever uses pretrained LVLM to compress entire page images into dense EOS token embeddings aligned with OCR content","LVLM based dual encoding of queries and document images, maximum inner product search for retrieval, top-K retrieved page images concatenated with question is used to generate answer autoregressively","VDocRetrieve pre-trained on 500K document image-OCR pairs using 2 objectives: RCR + RCG, LLM frozen, only LoRA + projector updated"
5,MoLoRAG,wu2025molorag,ViT; Qwen2-VL; RAG,page visual encoder; VLM traversal backbone; retrieve-then-read framework,Multi-Page VRDU Model,N/A,N/A,"Construct a page level graph, then uses a lightweight VLM as retrieval engine to traverse graph and score pages on semantic similarity and logical relevance to question","ColPali to encode document and build page graph, Qwen2.5VL-3B as retrieval engine for logical relevance scoring, top K retrieved pages images fed into arbitrary LVLM for answer generation",N/A
5,AVIR,li2025avir,Pix2Struct; Qwen2-VL,page relevance scoring backbone; adaptive answer generation backbone,Multi-Page VRDU Model,N/A,N/A,"Lightweight Pix2Struct scores pages based on question relevance, then use K-means clustering (for long docs) or threshold filtering (for short docs) to select most relevant pages","Frozen Pix2Struct encoder (100M) with 2 self attention layers and a sigmoid head for relevance scoring + frozen AWQ quantized Qwen2.5-VL-3B for answer generation, receiving only adaptively selected pages",N/A
5,KGP,wang2024knowledge,RAG; BERT; BM25,retrieval-augmented framework; text encoder for KG nodes; sparse retrieval,Multi-Page VRDU Model,N/A,N/A,Construct KG from documents (passages/pages/tables) + LLM-based graph traversal agent,"KG + LLM traversal (T5, LLaMA, ChatGPT) for retrieval + final answer from ChatGPT",N/A
5,LayTokenLLM,zhu2025simple,Transformer; LLaMA 3; LoRA; LayoutLMv3,architectural basis; LLM backbone; parameter-efficient fine-tuning; layout encoding inspiration,Multi-Page VRDU Model,N/A,N/A,Layout Token with New Positional Encoding Scheme for Layout Tokens without additional positional IDs.New Pretraining prediction pretraining. ,Layout Token is proposed to integrated into LLM as interleaved input with text tokens.,Next Interleaved Text and Layout Token Prediction
5,CREAM,zhang2024cream,RAG; BERT; T5; LoRA,coarse-to-fine retrieval framework; text embedding encoder; seq2seq reader; efficient fine-tuning,Multi-Page VRDU Model,N/A,N/A,Coarse-to-fine retrieval: text embedding similarity (coarse phase) + LLM-based multi-round gruoping and reranking (find phase) to identify more relevant chunks,Pix2Struct vision encoder extended via an attention pooling mechanism to handle multiple document pages --> projected into LLaMA2 7B via AdapterMLP layer,N/A
5,MHier-RAG,gong2025mhier,RAG; ColPali; Qwen2-VL; BM25,hierarchical retrieval framework; visual page retrieval; answer generation backbone; sparse first-stage retrieval,Multi-Page VRDU Model,N/A,N/A,Multi-modal RAG with two complementary hierarchical index structures: (1) a Flattened In-Page Index enabling parent-page retrieval with LLM-based re-ranking to bridge modality disconnection within a page; (2) a Topological Cross-Page Index using Gaussian Mixture Model clustering and LLM-generated summaries for document-level long-distance reasoning across pages,"Training free: Docling PDF parser --> textual chunks (plain text, tables, layout) --> LVLM generated visual descriptions + raw images --> dual hierarchical index --> multi-granularity retriever --> LLM answer with CoT + structured output prompting",N/A
5,Self-Attention Scoring,kang2024multi,Pix2Struct; ViT,page scoring backbone; patch encoder,Multi-Page VRDU Model,N/A,N/A,Convert document to image fed into Pix2Struct; page scoring to retrieve relevant pages using self-attention,Self-attention top-K retrieval + Pix2Struct VLM,N/A
5,InstructDr,tanaka2024instructdoc,LayoutLMv3; LLaMA 3; LoRA,document encoder backbone; LLM decoder; parameter-efficient fine-tuning,Multi-Page VRDU Model,N/A,N/A,A Document-former is used to bridge multimodal document represenstation and LLM textual representation. Multi-task instruction tuning is applied.,Cross-attention based Document Former is applied to bridge gap between vision encoder and LLM. Only Document-former and FFN layer are trainable.,N/A
5,PDF-WuKong,xie2024wukong,LLaVA; Qwen2-VL; ViT; LoRA,VLM architecture template; language backbone; visual encoder; efficient fine-tuning,Multi-Page VRDU Model,N/A,N/A,Introduce a Sparse Sampling module (task) to identify and extract the most relevant text chunks or diagrams based similary. Contrastive learning,The output from the text and image encoder are used to contrastive leraning and then feed into llm.,N/A
5,Texthawk2,yu2024texthawk2,CLIP; LLaMA 3; Qwen2-VL; LLaVA; SigLIP-SO400m,visual encoder; LLM backbone option; architecture comparison; VLM template; visual encoder alternative,Multi-Page VRDU Model,N/A,N/A,"16x Visual Token Compression (ReSampling & Rearrangement), Unified Visual Encoder, Detection Head, Multi-level Cross Attention",ViT + Resampler + LLM + Detection Head,N/A
5,Leopard,jia2024leopard,SigLIP-SO400m; LLaMA 3; LLaVA; MLP Projector,visual encoder; LLM backbone; architecture template; vision-language connector,Multi-Page VRDU Model,N/A,N/A,High quality instruction-tuning data. High-resolution multi-image encoding module.,"LEOPARD is decoder only vision language model, uses SigLIP-SO-400M as encoder, 2 layer MLP vison language connector and backbond LLM (LLaMA-3.1 or Mistral-7B)",N/A
5,mPLUG-DocOwl2,hu2025mplug,CLIP; LLaMA 3; LLaVA; LoRA,visual encoder; LLM backbone; VLM template; efficient fine-tuning,Multi-Page VRDU Model,N/A,N/A,"Introduce a novel compressing architecture to greatly reduce visual tokens of high resolution document images to enable multi-page document understanding. It leverages a Shape-adaptive Cropping Module and a low resolution vision encoder to encode high-resolution document images. The glolab visual feature can be enhanced by applying cross-attention with layout aligned high-resolution visual features. For multipage scenarios, a special token <img x> is added before each document image.",Build on Top of 1.5 version with a cross-attention absed High-reesolution DocCompressor.,"Single-image Pretraining, Multi-image Continue Pretraining"
5,LayoutLLM,luo2024layoutllm,LayoutLMv3; LLaMA 3; MLP Projector,document encoder; LLM backbone; vision-language connector,Multi-Page VRDU Model,N/A,N/A,Layout instruction tuning combining layout-aware pre-training with novel LayoutCoT module in SFT,LayoutLMv3-large as document encoder --> 2 MLP projectors (visual + text & layout) --> LLM backbone (causal decoder generates answer autoregressively),"Layout aware pre-training across 3 levels: document level, region-level, segment level, LLM frozen during pre-taining, only projectors and DocPTM encoder updated"
5,Docopilot,duan2025docopilot,LLaVA; Qwen2-VL; LoRA; ViT,architecture template; long-context VLM backbone; efficient fine-tuning; visual encoder,Multi-Page VRDU Model,N/A,N/A,Native long-context MLLM with Multimodal Data Packing and Ring Attention to achieve VQA without reliance on RAG,"Standard ViT-MLP-LLM architecture using pre-trained InternViT300M, 2 layer MLP projector, pretrained InternLM2 LLM decoder",InternVL2 (standard ViT + LLM)
5,Hi-VT5,tito2023hierarchical,T5; ViT,seq2seq backbone; visual patch encoder,Multi-Page VRDU Model,N/A,N/A,"Visual, textual and layout features passed to T5 encoder to produce answer",Hierarchical Transformer + per-page summary,T5 pretrained on single image docs
5,GRAM,blau2024gram,BERT; T5; ViT,cross-page text encoding; seq2seq backbone; visual encoder,Multi-Page VRDU Model,N/A,N/A,Extends pretrained SP Encoder + Decoder using Global-Local encoder blocks with document tokens that propagate information across pages,"Interleaved encoder-decoder transformer built on DocFormerv2, self attention applied only over cross-page doc tokens.",DocFormerv2 (no further pre-training)
5,Arctic-TILT,borchmann2025arctic,BERT; T5; ViT,text encoder basis; encoder-decoder framework; visual feature extraction,Multi-Page VRDU Model,N/A,N/A,"""Tensor Product"" modality fusion mechanism integrated within each transformer block, chunked processing and sparse attention to handle long documents","Encoder-decoder transformer based on T5, combined with contextualized vision from a U-Net with textual semantics using a fusion operation placed after the FFNs in every encoder layer","Self supervised pretraining using pretrained T5, then further 900K steps self supervised pretraining on document datasets after introducing TILT architecture modifications"
5,DocLLM,wang2024docllm,Transformer; LLaMA 3,disentangled spatial attention basis; LLM backbone,Multi-Page VRDU Model,N/A,N/A,"Extends standard LLMs with a disentangled spatial attention mechanism to capture cross-modal dependencies without vision encoder, pre-training uses autoregressive block infilling objective rather than next-token prediction","Causal decoder-only transformer (Falcon-1B or Llama2-7B) extended withspatia hidden vectors S and standard text hidden vectors H, attention decomposed into 4 disentangled scores (T2T, T2S, S2T, S2S) with only S2S activated at inference","Self supervised autoregressive block infilling: randomly mask text blocks, shuffles them, and reconstructs them sequentially using both preceding and following context"
5,DocSLM,hannan2025docslm,BERT; T5; ViT; LoRA,text encoder; seq2seq compression backbone; visual encoder; parameter-efficient fine-tuning,Multi-Page VRDU Model,N/A,N/A,"hierarchical multimodal compressor fuses visual, OCR text and layout features into fixed 576 token page representation + Streaming Abstention mechanism that processes document segments sequentially with entropy-based uncertainty calibration for constant memory footprint",SigLIP2 vision encoder + PaddleOCR extractor --> Local OCR compression --> Global visual compression --> MLP adapter --> Qwen2.5-1.5B SLM,1. OCR alignment 2. image compression 3. document compression (multi-page)
5,DocLayLLM,liao2025doclayllm,LayoutLMv3; LLaMA 3; LoRA; MLP Projector; DiT,document encoder; LLM backbone; parameter-efficient fine-tuning; vision-language connector; document visual backbone,Multi-Page VRDU Model,N/A,N/A,"Efficient OCR dependent MLLM extension of LLMs that integrates document patch tokens (visual) and 2D positional tokens (layout) directly into the LLM's inpt squence alongside OCR text, combined with CoT pretraining and CoT annealing",OCR engine --> text tokens + image patch tokens + bounding box tokens --> unified LLM (Llama2-7B / Llama3-8B) with LoRA; no separate document encoder,"(not strictly pretraining) broad instruction tuning across many document tasks to align visual and layout tokens with the LLM, using ~3.1M diverse pairs"
