Tier,Name,BibTex (Unverified),Dependencies,Relationship,Category,Encoder / Decoder,Description,Key Technique,Architecture,(Pre)-training Objective
0,BM25,robertson2009probabilistic,None,None,Retrieval Algorithm,N/A,"A robust bag-of-words retrieval function that ranks documents based on the appearance of query terms, serving as a standard baseline for sparse retrieval.",Probabilistic term-weighting over TF-IDF. Scores documents by term frequency saturation and document-length normalisation.,"Does not have a neural architecture. It relies on mathematical frequency counts (Term Frequency, Inverse Document Frequency) and hyperparameters (k1, b) to tune length normalization.",No pre-training or learned parameters. It relies strictly on corpus statistics.
0,Transformer,vaswani2017attention,None,None,Foundation Architecture,Encoder + Decoder,"The foundational sequence-to-sequence model that dispensed with recurrence and convolutions entirely, relying solely on attention mechanisms to draw global dependencies between input and output.","Self-attention over sequences of token embeddings, enabling each position to attend to every other position in O(n²).","Composed of an encoder and a decoder stack. Each layer contains Multi-Head Self-Attention and a position-wise fully connected feed-forward network, augmented with residual connections and layer normalization. Positional encodings are injected to retain sequence order.",Supervised sequence-to-sequence training on the WMT 2014 English-German dataset for machine translation using cross-entropy loss.
0,InfoNCE,oord2018representation,Cross-Entropy,Extends,Loss Function,N/A,A contrastive loss function used for representation learning. It trains models to distinguish a matching 'positive' pair from a large pool of 'negative' pairs within a batch.,Pulls positive pairs closer in embedding space while pushing away multiple negative examples within the same batch.,N/A,N/A
0,MaxSim,khattab2020colbert,None,None,Similarity Metric,N/A,A fine-grained similarity scoring mechanism used in Late Interaction retrieval models to compare multi-vector representations of queries and documents instead of single global vectors.,Compares every token in a query against every token in a document and sums the maximum matches.,N/A,N/A
0,Cross-Entropy,goodfellow2016deep,None,None,Loss Function,N/A,The standard classification loss function that measures the performance of a classification model whose output is a probability value between 0 and 1.,Measures the difference between two probability distributions for a given random variable.,N/A,N/A
0,Sigmoid Contrastive Loss,zhai2023sigmoid,Cross-Entropy,Alternative to,Loss Function,N/A,"A scalable alternative to standard softmax contrastive loss. It processes solely on image-text pairs and avoids global normalization, allowing for theoretically infinite batch sizes across TPUs.","Computes pairwise sigmoid loss instead of softmax, avoiding the need for cross-device synchronization and large batch sizes.",N/A,N/A
1,BERT,devlin2018bert,Transformer,Uses,Language Model,Encoder,"A landmark language model that introduced deep bidirectional pre-training by masking tokens, allowing the model to learn context from both left and right simultaneously.",Masked language modeling to learn deep bidirectional representations.,Consists of a multi-layer bidirectional Transformer encoder. It drops the decoder entirely. It uses WordPiece tokenization and adds special [CLS] and [SEP] tokens.,"Pre-trained on two tasks: Masked Language Modeling (MLM) where 15% of tokens are masked and predicted, and Next Sentence Prediction (NSP) to understand sentence relationships."
1,ViT,dosovitskiy2020image,Transformer,Uses,Vision Model,Encoder,"The first model to successfully apply a standard Transformer directly to images with minimal modifications, proving convolutions are not strictly necessary for vision tasks.",Treats image patches as tokens and processes them through a standard Transformer encoder.,"An image is split into fixed-size patches (e.g., 16x16), linearly embedded into flat vectors, and fed into a standard Transformer Encoder along with learnable positional embeddings and a [CLS] token.",Supervised image classification pre-training on massive datasets (ImageNet-21k or JFT-300M) before fine-tuning on smaller datasets.
1,T5,raffel2020exploring,Transformer,Uses,Language Model,Encoder + Decoder,"A unified framework that casts every NLP problem (translation, QA, summarization) into a text-to-text format, allowing the exact same model, objective, and hyperparameters to be used across diverse tasks.",Frames all NLP tasks as text-to-text generation.,"Follows the original Transformer encoder-decoder architecture closely, but uses relative positional embeddings instead of absolute ones.",Pre-trained using a span-corruption objective (a variant of Masked Language Modeling) on the massive Colossal Clean Crawled Corpus (C4).
1,DiT (Document Image Transformer),li2022dit,ViT,Extends,Vision Model,Encoder,A vision transformer specifically adapted for Document AI. It captures the complex visual layouts and structures of document images without relying on OCR text as input.,Pre-trained on large-scale unlabeled document images using generative masked image modeling.,Standard ViT architecture but trained specifically on document images (IIT-CDIP Test Collection) rather than natural scenes.,"Masked Image Modeling (MIM). Patches of the document image are masked, and the model must reconstruct the visual pixels of the masked patches."
1,BEiT,bao2021beit,ViT,Extends,Vision Model,Encoder,"A self-supervised vision model that treats image patches like text tokens, introducing a BERT-like pre-training approach for the visual domain.",Introduces masked image modeling for vision transformers.,"Standard Transformer encoder. Instead of raw pixels, it uses a discrete variational autoencoder (dVAE) to tokenize images into visual tokens.","Masked Image Modeling (MIM). The model predicts the discrete visual tokens of masked image patches, similar to how BERT predicts masked words."
1,BART,lewis2019bart,BERT; GPT,Uses; Uses,Language Model,Encoder + Decoder,A denoising autoencoder for pretraining sequence-to-sequence models. It combines the bidirectional encoding of BERT with the autoregressive decoding of GPT.,Pre-trained by corrupting text with an arbitrary noising function and learning to reconstruct the original.,"Standard Transformer encoder-decoder architecture. The encoder processes the corrupted text bidirectionally, and the decoder generates the original text autoregressively.","Sequence-to-sequence denoising. Text is corrupted via multiple noise functions (token masking, token deletion, text infilling, sentence permutation, document rotation). The model must reconstruct the original clean text."
1,GPT,brown2020language,Transformer,Uses,Language Model,Decoder,"The foundational causal language model series. By predicting the next word on massive datasets, it demonstrated that unsupervised learning produces highly capable generalist language models.",Autoregressive generation of text.,"A Transformer decoder-only architecture. It uses masked self-attention to ensure that a token can only attend to previous tokens in the sequence, preserving the autoregressive property.","Unsupervised Next Token Prediction. Given a sequence of tokens, the model is trained to maximize the likelihood of predicting the correct subsequent token."
2,ColBERT,khattab2020colbert,BERT; MaxSim,Uses; Uses,Retrieval Model,Encoder,A dense retrieval model that resolves the tradeoff between efficiency and effectiveness by using 'late interaction' to calculate fine-grained similarity without feeding query-document pairs jointly through BERT.,Late interaction mechanism using MaxSim over token-level embeddings.,"Utilizes dual BERT encoders (one for queries, one for documents). Instead of pooling to a single vector, it outputs a matrix of token-level embeddings for both. Match score is computed via MaxSim.","Trained using a pairwise contrastive ranking loss, ensuring the positive document scores higher than sampled negative documents for a given query."
2,CLIP,radford2021learning,ViT; Transformer; InfoNCE,Uses; Uses; Uses,Vision-Language Model,Encoder,"A foundational multimodal model that learns highly robust, zero-shot transferable visual concepts by training on hundreds of millions of image-caption pairs scraped from the internet.",Aligns images and text in a joint embedding space using a massive batch size and contrastive loss.,Dual Encoder architecture: A Vision Encoder (ViT or ResNet) and a Text Encoder (Transformer). The pooled outputs of both are mapped to a shared multimodal embedding space.,Contrastive Language-Image Pre-training (InfoNCE). The model maximizes the cosine similarity of the correct image-text pairs while minimizing the similarity of millions of incorrect pairs in the batch.
2,Pix2Struct,lee2022pix2struct,ViT; Transformer,Uses; Uses,Vision-Language Model,Encoder + Decoder,A visually-situated language model designed to understand visually rich contexts like webpages by parsing screenshots into structured representations without relying on OCR.,Trained to parse masked screenshots of web pages into underlying HTML/structured representations.,"A ViT encoder processes the image, and a Transformer decoder generates the structured text. It handles variable-resolution images by adapting the patch grid dynamically.",Pre-trained via an objective called 'screenshot parsing' where it learns to reconstruct the masked HTML structure directly from a webpage screenshot.
2,SigLIP-SO400m,zhai2023sigmoid,CLIP; Sigmoid Contrastive Loss,Extends; Uses,Vision-Language Model,Encoder,"An advancement over CLIP that replaces the softmax loss with a sigmoid loss, allowing for vastly more efficient training and scaling up to larger models (like 400M parameters) with better performance.",Uses sigmoid contrastive loss to scale batch sizes infinitely and improve performance.,"Dual Encoder architecture identical in concept to CLIP (ViT for vision, Transformer for text), but optimized for sigmoid loss scaling.","Sigmoid Contrastive Learning. It treats every image-text pair in the batch as an independent binary classification problem, removing the global softmax bottleneck."
2,DPR,karpukhin2020dense,BERT,Uses,Retrieval Model,Encoder,The model that popularized dense retrieval for Open-Domain QA. It demonstrated that retrieving passages using dense neural embeddings could significantly outperform sparse algorithms like BM25.,Uses dual encoders to represent queries and passages as dense vectors and matches them via inner product.,Dual BERT encoders (Query Encoder and Passage Encoder). The [CLS] token representation is used as the dense 768-dimensional vector for both.,Trained using contrastive learning with in-batch negatives and hard negatives (passages retrieved by BM25 that don't contain the answer) to distinguish relevant from irrelevant passages.
2,LayoutLMv3,huang2022layoutlmv3,Transformer; ViT; BERT,Uses; Uses; Uses,Document Encoder Model,Encoder,"A state-of-the-art Document AI model that jointly models text, layout (bounding boxes), and image features in a single unified transformer, eliminating the need for complex CNN visual backbones.","Jointly models text, layout, and image embeddings using unified masked modeling objectives.","A multi-modal Transformer encoder. It takes three inputs: text tokens, 2D spatial coordinate embeddings (layout), and linear projections of image patches (vision).","Pre-trained with three objectives: Masked Language Modeling (MLM), Masked Image Modeling (MIM) predicting patch discrete tokens, and Word-Patch Alignment (WPA) to learn fine-grained cross-modal alignments."
3,LLaMA 3,touvron2023llama,Transformer; GPT,Uses; Extends,Language Model,Decoder,"Meta's highly optimized, open-weights large language model series. It achieves state-of-the-art performance through massive data scale (15T tokens) and architectural efficiency improvements.","Uses Grouped-Query Attention (GQA), RoPE embeddings, and SwiGLU activations with a 128k vocabulary.","Decoder-only transformer. Features Grouped-Query Attention (to reduce KV cache memory for long contexts), Rotary Positional Embeddings (RoPE) to model sequence order relatively, and SwiGLU activations.","Standard autoregressive next-token prediction, followed by extensive post-training alignment using Supervised Fine-Tuning (SFT) and Direct Preference Optimization (DPO)."
3,LLaVA,liu2023visual,LLaMA 3; CLIP; MLP Projector,Uses; Uses; Uses,Multimodal LLM,Decoder,"A pioneering model that bridges pre-trained vision encoders and large language models using a simple projection layer, enabling the LLM to 'see' and follow visual instructions.",Connects a frozen visual encoder (CLIP) to a frozen LLM (Llama) via a trainable projection layer.,Combines a pre-trained CLIP ViT visual encoder and a pre-trained LLM (like Vicuna/LLaMA). They are connected via a 2-layer MLP projection layer which maps visual patches to the LLM's text embedding space.,"Stage 1 (Feature Alignment): Freeze vision and LLM, train only the MLP projector using image-text pairs. Stage 2 (Visual Instruction Tuning): Freeze vision, train projector and LLM on GPT-4 generated multimodal instruction data."
3,RAG,lewis2020retrieval,DPR; BART,Uses; Uses,Framework,Encoder + Decoder,"The seminal framework that combines a neural retriever with a generative LLM, allowing the model to ground its answers in external, non-parametric knowledge bases to reduce hallucinations.",Combines a dense retriever (DPR) with a seq2seq generator (BART) to ground outputs in external knowledge.,Comprises a Retriever (Dense Passage Retriever with dual BERT encoders) and a Generator (BART-large encoder-decoder). The generator concatenates the query and the retrieved documents in its context window.,"End-to-end training using marginal log-likelihood. The Generator and Query Encoder are fine-tuned jointly to produce the correct answer, while the Document Index (FAISS) and Document Encoder are typically kept frozen."
3,InternViT-6B,chen2023internvl,ViT,Extends,Vision Model,Encoder,"A massive 6 billion parameter Vision Transformer designed to capture extremely high-resolution and robust visual features, bridging the parameter gap between vision and language models.","Scales ViT to 6 billion parameters for high-resolution, robust visual feature extraction.",An aggressively scaled-up Transformer encoder with modifications like improved layer scaling and RMSNorm to stabilize the training of a 6B parameter vision backbone.,Trained with a combination of Contrastive Learning (aligning with text) and generative Masked Image Modeling to ensure deep representation learning.
3,Qwen2-VL,wang2023qwen,Transformer; ViT,Uses; Uses,Multimodal LLM,Decoder,"A highly capable multimodal LLM from Alibaba. It natively supports dynamic resolution for images and videos, allowing it to process documents and UI screens without losing aspect ratios or fine details.","Supports dynamic resolution for images and videos, integrating them natively into the LLM context.",Integrates a Vision Encoder with dynamic resolution support (AnyRes) and a Qwen2 LLM decoder. It uses multi-layer perceptron projectors to map dynamic numbers of visual tokens into the language space.,"Multimodal Next Token Prediction. Trained extensively on interleaved image-text data, video-text data, and specifically curated visually rich document datasets."
3,InternVL2,chen2023internvl,InternViT-6B; LLaMA 3,Uses; Uses,Multimodal LLM,Decoder,An open-source Multimodal Foundation Model that leverages the massive InternViT-6B encoder and advanced LLMs (like LLaMA 3) to achieve closed-source level performance on document understanding.,"Aligns a massive vision encoder with advanced LLMs, capable of high-resolution document understanding.",Architecture pairs the massive InternViT-6B visual encoder with an LLM decoder (variable sizes up to 100B+). It dynamically splits high-resolution images into multiple 448x448 tiles to preserve detail.,Progressive training paradigm: 1. Vision-language alignment. 2. Pre-training on interleaved data. 3. Supervised fine-tuning on high-quality multimodal instruction data.
3,PaliGemma,beyer2024paligemma,SigLIP-SO400m; Gemma 2,Uses; Uses,Multimodal LLM,Encoder + Decoder,"Google's open Vision-Language Model optimized for fast and accurate multimodal tasks. It uses an unmasked, full-attention processing of images and text prompts.",Combines SigLIP vision encoder and Gemma language model.,Fuses a SigLIP-So400m vision encoder with a Gemma decoder model via a linear projection layer. The image tokens and text tokens are concatenated without any complex pooling.,"Joint multimodal pre-training on diverse tasks (captioning, VQA, detection) using standard cross-entropy loss, designed to be easily fine-tuned for downstream applications."
3,DocFormerv2,appalaraju2023docformerv2,Transformer,Uses,Document AI Model,Encoder + Decoder,A state-of-the-art model for visually rich documents that introduces an asymmetric pre-training approach to improve efficiency and performance over previous LayoutLM-style models.,Uses an asymmetric encoder-decoder where the encoder extracts joint features and a lightweight decoder reconstructs them.,"Features an asymmetric Transformer Encoder-Decoder. The heavy encoder processes multimodal inputs (text, vision, layout), while a very shallow decoder is used strictly during pre-training for reconstruction.","Asymmetric Masked Modeling. The model is trained to reconstruct masked tokens and visual patches. The decoder is discarded after pre-training, leaving a highly efficient encoder for downstream tasks."
3,Gemma 2,gemma2team2024gemma,Transformer; Gemma; Gemini; GQA; RoPE; RMSNorm,Uses; Extends; Distilled from; Uses; Uses; Uses,Language Model,Decoder,"A high-performance series of open-weights LLMs from Google (2B, 9B, 27B). It is designed to punch above its weight class by using a massive teacher model (Gemini) for knowledge distillation and a more complex attention architecture than its predecessor.","Interleaved Local-Global Attention, Logit Soft-capping, and Large-Scale Knowledge Distillation.","A decoder-only Transformer that alternates between Local Sliding Window Attention (window size 4096) and Global Attention (8192 span) in every other layer. It features logit soft-capping (tanh-based) in attention and final layers to prevent logit drift, uses Grouped-Query Attention (GQA), and applies RMSNorm for both pre- and post-normalization to stabilize deep training.",Autoregressive Next-Token Prediction combined with Knowledge Distillation. Smaller models (2B/9B) are trained by minimizing the negative log-likelihood (NLL) between their output probabilities and the probabilities of a larger Gemini teacher model across trillions of tokens.
4,ColPali,faysse2024colpali,ColBERT; PaliGemma,Extends; Uses,Retrieval Model,Encoder,A novel vision-retrieval model for documents that completely bypasses OCR. It applies ColBERT's late interaction directly to the visual patch embeddings of document pages.,"Applies late interaction directly to image patches of document pages, bypassing OCR.",Uses the PaliGemma vision encoder (SigLIP-based) combined with a ColBERT-style late interaction mechanism. The image patches are directly mapped to a token-level embedding space without generating text.,Contrastive learning using InfoNCE loss combined with Late Interaction (MaxSim). It aligns user text queries directly with the raw visual image patches of document pages.
4,CoT,wei2022chain,GPT,Prompting Strategy,Prompting Framework,N/A,"Chain-of-Thought Prompting. A paradigm shift in how LLMs are queried, significantly boosting reasoning capabilities by forcing the model to articulate intermediate logical steps.",Prompts the LLM to explicitly output step-by-step reasoning before generating the final answer.,N/A,N/A
4,Vicuna,chiang2023vicuna,LLaMA 3,Extends,Language Model,Decoder,"An open-source chatbot trained by fine-tuning LLaMA models on user-shared conversations collected from ShareGPT, proving that high-quality conversational data can rapidly align base models.",Fine-tuned LLaMA on user-shared conversations.,Identical to the base LLaMA architecture (Decoder-only Transformer). The difference lies entirely in the post-training alignment data.,Supervised Fine-Tuning (SFT) on approximately 70K high-quality user-shared conversations to learn human-like dialogue patterns and instruction following.
4,MinerU,mineru2024,Transformer; ViT,Uses; Uses,Document Parsing Tool,Encoder + Decoder,"A highly precise tool/pipeline designed to extract structured markdown from complex PDFs, crucial for generating high-quality RAG corpora from visually rich documents containing tables and formulas.","Uses vision models to parse layouts, formulas, and tables into markdown representations.","A pipeline rather than a single model. It combines object detection models (for layout analysis), OCR engines, and specialized vision-language models for translating math formulas and tables to LaTeX/Markdown.","Various supervised tasks depending on the pipeline component (e.g., bounding box detection for layout, image-to-sequence for formulas)."
4,Adapter (Houlsby 2019),houlsby2019parameter,Transformer,Extends,Parameter Efficient Fine Tuning,N/A,"A technique to fine-tune massive models without updating all weights. It inserts small bottleneck layers into the transformer, updating only ~3% of the parameters while matching full fine-tuning performance.",Inserts small trainable feed-forward networks between transformer layers while freezing original weights.,Small bottleneck Multi-Layer Perceptrons (MLPs) are injected sequentially after the attention and feed-forward modules of a standard Transformer block. The original network weights are kept frozen.,"Supervised Fine-Tuning. Only the newly injected Adapter layers receive gradient updates, significantly reducing memory requirements during training."
4,MLP Projector,liu2023visual,Transformer,Component,Architecture Component,N/A,A simple but critical network component used in modern multimodal LLMs to translate features extracted from a visual encoder into the mathematical embedding space of the language model.,Typically 2-layer MLP with GELU used in models like LLaVA to map visual features to text embedding space.,"A Multi-Layer Perceptron. Usually consists of a linear layer, a non-linear activation function (like GELU), and another linear layer to match the hidden dimension of the LLM.","Trained via Feature Alignment objectives. It receives gradient updates while the larger vision and language models are kept frozen, learning to 'translate' between the two modalities."
4,LoRA,hu2021lora,Transformer,Extends,Parameter Efficient Fine Tuning,N/A,"Low-Rank Adaptation. The most widely used parameter-efficient fine-tuning method. It assumes that the weight updates during fine-tuning have a low intrinsic rank, drastically reducing trainable parameters.",Injects trainable low-rank matrices into transformer attention blocks to reduce fine-tuning parameters.,"Instead of updating a full weight matrix (W), LoRA freezes W and adds a low-rank decomposition matrix (B x A) in parallel. For inference, B x A is simply added to W, resulting in zero latency overhead.","Supervised Fine-Tuning. Only the low-rank matrices A and B receive gradient updates, allowing models like LLaMA to be fine-tuned on consumer GPUs."
4,ReAct,yao2022react,CoT; GPT,Extends; Uses,Agentic Framework,N/A,A foundational agentic prompting framework that enables LLMs to interface with external tools (like search engines or calculators) by interleaving reasoning steps with actionable tool calls.,Interleaves Thought-Action-Observation steps to allow LLMs to use external tools.,N/A,N/A
5,ViDoRAG,wang2025vidorag,RAG; ColPali; Qwen2-VL; ReAct; BM25,extends retrieval; visual retrieval; answer generation backbone; agentic reasoning pattern; sparse retrieval,Multi-Page VRDU Model,N/A,N/A,"Multi-agent iterative reasoning (Seeker, Inspector, Answer agents); GMM-based dynamic hybrid retrieval (Text + Vision)",Multi-agent RAG framework + GMM-based hybrid retriever,N/A
5,Doc-React,wu2025doc,RAG; BERT; BM25; T5,extends iteratively; dense retrieval encoder; sparse fallback; seq2seq reader,Multi-Page VRDU Model,N/A,N/A,Adaptive iterative retrieval framework that maximises entropy-normalised nutual information gain at each step,"Pipeline that wrap an existing MLLM (GPT-4o) and multimodal retrieval model (ColPali / VisRAG-Ret), MLLM acts as both judge and generator within ReAct-style loop",N/A
5,Doc-Agent,sun2025docagent,RAG; ReAct; CoT (Chain-of-Thought); LLaMA 3,extends; agent loop pattern; reasoning traces; LLM backbone,Multi-Page VRDU Model,N/A,N/A,"Multi-agent framework mimicking human reading, extracts a hierarchical XML tree-structured outline from the document, then use an actor agent with 5 retrieval tools to gather evidence, reviewer agent cross-checks answers from complementary sources/modalities, reflection-based memory bank for knowledge transfer across tasks","Training-free pipeline: 1. Outline construction (adobe PDF extract --> XML tree) 2. Actor agent (LLM + 5 tools: search, get_section_content, get_image, get_page_images, get_table_image) 3. ReviewAgent (same toolset, independent trajectory) 4. Reflection Memory Module (LLM-generated verbal guidelines, cumulative string memory)",N/A
5,MDocAgent,han2025mdocagent,ColBERT; ColPali; RAG; ReAct; Qwen2-VL,text retrieval; visual retrieval; retrieve-then-read paradigm; agent orchestration; VLM backbone,Multi-Page VRDU Model,N/A,N/A,"Design a multi-agent framework to integrate specialized agents from text/image understanding, critical information extraction and fianl answer prediction.",Multi-agents structure combining several LLMs/MLLMs.,N/A
